{"attempts":[{"attempt_id":"310422af-6ec1-4859-baa8-2fbfa46dede9","dispatch_state":"DISPATCHED","invocation":{"durable_execution_arn":"arn:aws:lambda:us-east-1:111122223333:function:SucRua-validation-6051132-DurableVariantCallerFunc-o4FUKNesHDwt:1/durable-execution/74a2ccda-7109-444f-bf93-3a0347d46e78/7cf9bb0f-95d5-3c1d-bd2b-75e3cf6cfbbd","message_id":"7c82701d-0e64-44f7-a2e0-31b39e6de091","receive_count":1,"source":"durable_caller","source_instance_id":"2c29681a-5143-41cb-89b8-9d0d6eb1d4f6","step_attempt":1},"knowledge_after_derived":"UNKNOWN","knowledge_after_recorded":"UNKNOWN","late_transport_settlement":{"observed_after_elapsed_ns":"3005914163","settlement_kind":"aborted"},"outcome":"TIMED_OUT","outcome_class":"AMBIGUOUS","provider_call_id":"ac374686-fb5d-420e-86c7-4ac9956bb1b3","provider_request_id":"df7b0235-7712-48f5-9a2d-7970e555baf0","provider_transaction_id":"ad235a3f-75f0-475b-99dd-3fe4ed97826a","refund_request_id":"ref-poc-001","registered_event_id":"b7ac51f8-a974-4d24-8364-15d630dcc34f"},{"attempt_id":"7899c59b-b2a5-4f12-91ad-a7df45f6952f","dispatch_state":"DISPATCHED","invocation":{"durable_execution_arn":"arn:aws:lambda:us-east-1:111122223333:function:SucRua-validation-6051132-DurableVariantCallerFunc-o4FUKNesHDwt:1/durable-execution/74a2ccda-7109-444f-bf93-3a0347d46e78/7cf9bb0f-95d5-3c1d-bd2b-75e3cf6cfbbd","message_id":"7c82701d-0e64-44f7-a2e0-31b39e6de091","receive_count":1,"source":"durable_caller","source_instance_id":"0427b038-81da-4482-8440-dd024955c173","step_attempt":2},"knowledge_after_derived":"UNKNOWN","knowledge_after_recorded":"UNKNOWN","outcome":"SUCCEEDED","outcome_class":"SUCCESS","provider_call_id":"f67469ed-3474-40a4-8daa-faf16c3bedb8","provider_request_id":"97aea0be-80e5-40c5-be97-6837b1b9824d","provider_transaction_id":"8c791a4b-5ae9-4a02-bf81-2ef5289664b0","refund_request_id":"ref-poc-001","registered_event_id":"584e16a9-63ab-4bdf-91b7-07a3440d745d"}],"derived_at":"2026-10-07T05:54:15.730Z","durable_executions":[{"durable_execution_arn":"arn:aws:lambda:us-east-1:111122223333:function:SucRua-validation-6051132-DurableVariantCallerFunc-o4FUKNesHDwt:1/durable-execution/74a2ccda-7109-444f-bf93-3a0347d46e78/7cf9bb0f-95d5-3c1d-bd2b-75e3cf6cfbbd","status":"SUCCEEDED"}],"execution_manifest_sha256":"c39605d9b960dacf90d6d55523843d7e08b0e9def09fdbcb0b0263ea191986df","provider_calls":[{"attempt_id":"310422af-6ec1-4859-baa8-2fbfa46dede9","disposition":"ACCEPTED","provider_call_id":"ac374686-fb5d-420e-86c7-4ac9956bb1b3","provider_request_id":"df7b0235-7712-48f5-9a2d-7970e555baf0","received_event_id":"6b1fba26-1280-4d0f-aaae-c523ee160677"},{"attempt_id":"7899c59b-b2a5-4f12-91ad-a7df45f6952f","disposition":"ACCEPTED","provider_call_id":"f67469ed-3474-40a4-8daa-faf16c3bedb8","provider_request_id":"97aea0be-80e5-40c5-be97-6837b1b9824d","received_event_id":"27b87701-cad8-4633-b781-a774cdcc09e7"}],"record_type":"attempt_projection","schema_version":1,"transactions":[{"ledger_ref":{"artifact_path":"trials/217c7cb6-6d7a-4a75-95e1-c82aeec69761/ledger/ledger-snapshot.json","artifact_sha256":"e1aa267544629036d60eee0665795f7024d44f9f2cd4fa8ee0ae30646493cab8","json_pointer":"/transactions/0"},"provider_call_id":"f67469ed-3474-40a4-8daa-faf16c3bedb8","provider_commit_id":"8ab1cf76-a899-4a3f-97b9-84f13cd8af6a","provider_transaction_id":"8c791a4b-5ae9-4a02-bf81-2ef5289664b0"},{"ledger_ref":{"artifact_path":"trials/217c7cb6-6d7a-4a75-95e1-c82aeec69761/ledger/ledger-snapshot.json","artifact_sha256":"e1aa267544629036d60eee0665795f7024d44f9f2cd4fa8ee0ae30646493cab8","json_pointer":"/transactions/1"},"provider_call_id":"ac374686-fb5d-420e-86c7-4ac9956bb1b3","provider_commit_id":"5a3997d4-9149-4526-b07a-982c96327a20","provider_transaction_id":"ad235a3f-75f0-475b-99dd-3fe4ed97826a"}],"trial_id":"217c7cb6-6d7a-4a75-95e1-c82aeec69761","trial_manifest_sha256":"8274f2c1116074d11ceab7f30aa191ccfa19efe18845b0e94da2f91ef8127192","variant_validation_id":"60511328-ab4d-4234-81ab-0b042a20e658"}
