{"attempts":[{"attempt_id":"00000000-0000-4000-8000-000000000300","dispatch_state":"DISPATCHED","invocation":{"message_id":"message-0001","receive_count":1,"source":"conventional_caller","source_instance_id":"00000000-0000-4000-8000-000000000201"},"knowledge_after_derived":"UNKNOWN","knowledge_after_recorded":"UNKNOWN","late_transport_settlement":{"observed_after_elapsed_ns":"250000000","settlement_kind":"resolved"},"outcome":"TIMED_OUT","outcome_class":"AMBIGUOUS","provider_call_id":"00000000-0000-4000-8000-000000000402","provider_request_id":"00000000-0000-4000-8000-000000000301","provider_transaction_id":"00000000-0000-4000-8000-000000000401","refund_request_id":"refund-request-0001","registered_event_id":"00000000-0000-4000-8000-000000000501"}],"derived_at":"2026-10-05T12:00:00.900Z","durable_executions":[],"execution_manifest_sha256":"e74ab218bef3d5c57e6cc21108b96ababcc200448df75d7d62acc9751a9b655f","provider_calls":[{"attempt_id":"00000000-0000-4000-8000-000000000300","disposition":"ACCEPTED","provider_call_id":"00000000-0000-4000-8000-000000000402","provider_request_id":"00000000-0000-4000-8000-000000000301","received_event_id":"00000000-0000-4000-8000-000000000502"},{"disposition":"REJECTED","provider_call_id":"00000000-0000-4000-8000-000000000403","received_event_id":"00000000-0000-4000-8000-000000000503","rejection_reason":"AMOUNT_INVALID"},{"disposition":"UNRESOLVED","provider_call_id":"00000000-0000-4000-8000-000000000404","received_event_id":"00000000-0000-4000-8000-000000000504"}],"record_type":"attempt_projection","run_id":"00000000-0000-4000-8000-000000000100","schema_version":1,"transactions":[{"ledger_ref":{"artifact_path":"trials/00000000-0000-4000-8000-000000000103/ledger/ledger-snapshot.json","artifact_sha256":"985519a15a17ce4b43d70dfed2bf33638f8e93f84b1d74562726a16aee3c848b","json_pointer":"/transactions/0"},"provider_call_id":"00000000-0000-4000-8000-000000000402","provider_commit_id":"00000000-0000-4000-8000-000000000400","provider_transaction_id":"00000000-0000-4000-8000-000000000401"}],"trial_id":"00000000-0000-4000-8000-000000000103","trial_manifest_sha256":"9d1b59c5a9eed2d2ca00ec23236dfe5c0a059a899b719c9d7ad81b3d6391cee0"}
