{"attempts":[{"attempt_id":"cbea0b82-6f93-44be-81f6-ae21a47dba7c","dispatch_state":"DISPATCHED","invocation":{"message_id":"34585c62-6668-4ef5-9f23-79f246858a6b","receive_count":1,"source":"conventional_caller","source_instance_id":"35319ef8-2499-4182-bfe7-801091d4922e"},"knowledge_after_derived":"ONE_EFFECT_CONFIRMED","knowledge_after_recorded":"ONE_EFFECT_CONFIRMED","outcome":"SUCCEEDED","outcome_class":"SUCCESS","provider_call_id":"7b9f2833-2c28-46a3-abf6-c40a03d0bd12","provider_request_id":"ecc79828-6904-41a1-8e9d-a9955a0c9a70","provider_transaction_id":"45414a50-a268-4aa1-ab91-ffe75625c2fa","refund_request_id":"ref-poc-001","registered_event_id":"27560dc5-3790-46eb-9e20-4f402c3fb787"}],"derived_at":"2026-10-07T04:58:08.374Z","durable_executions":[],"execution_manifest_sha256":"5459474242d205254c43b902dc31625e8ad7681fb9dafcba08a53ee38be92fec","provider_calls":[{"attempt_id":"cbea0b82-6f93-44be-81f6-ae21a47dba7c","disposition":"ACCEPTED","provider_call_id":"7b9f2833-2c28-46a3-abf6-c40a03d0bd12","provider_request_id":"ecc79828-6904-41a1-8e9d-a9955a0c9a70","received_event_id":"78048a70-928c-45a5-b817-54d201aa5cee"}],"record_type":"attempt_projection","schema_version":1,"transactions":[{"ledger_ref":{"artifact_path":"trials/d0f24b36-9215-492e-80cf-e567f0977476/ledger/ledger-snapshot.json","artifact_sha256":"b7c0de802d63c00f728751fd3e0d9b744689caf61c9d817eaa2e9097fea1e5c0","json_pointer":"/transactions/0"},"provider_call_id":"7b9f2833-2c28-46a3-abf6-c40a03d0bd12","provider_commit_id":"010503b8-012c-4b3d-86da-92ef99ad692d","provider_transaction_id":"45414a50-a268-4aa1-ab91-ffe75625c2fa"}],"trial_id":"d0f24b36-9215-492e-80cf-e567f0977476","trial_manifest_sha256":"fd1f3480f44a4c5bd8012e4b0b624d311b5a9db81cd0e2ee54269757e03b9920","variant_validation_id":"a8a5b2f1-61d2-4712-9c54-34114abfd54e"}
